{
  "$schema": "https://json-schema.org/draft/2020-12/schema",
  "$id": "https://trader-ralph.com/schemas/runtime/v1/asset_record",
  "type": "object",
  "properties": {
    "schemaVersion": {
      "type": "string",
      "const": "v1"
    },
    "assetKey": {
      "type": "string",
      "minLength": 1
    },
    "displayName": {
      "type": "string",
      "minLength": 1
    },
    "symbol": {
      "type": "string",
      "minLength": 1
    },
    "chainKey": {
      "type": "string",
      "minLength": 1
    },
    "canonicalId": {
      "type": "string",
      "minLength": 1
    },
    "assetKind": {
      "type": "string",
      "enum": ["native", "token", "stablecoin", "wrapped", "synthetic"]
    },
    "riskClass": {
      "type": "string",
      "enum": ["core", "standard", "volatile", "experimental", "restricted"]
    },
    "listingState": {
      "type": "string",
      "enum": ["candidate", "shadow", "paper", "live", "paused", "deprecated"]
    },
    "decimals": {
      "type": "integer",
      "minimum": 0,
      "maximum": 9007199254740991
    },
    "aliases": {
      "type": "array",
      "items": {
        "type": "string",
        "minLength": 1
      }
    },
    "quoteAssetKeys": {
      "minItems": 1,
      "type": "array",
      "items": {
        "type": "string",
        "minLength": 1
      }
    },
    "venueMappings": {
      "minItems": 1,
      "type": "array",
      "items": {
        "type": "object",
        "properties": {
          "venueKey": {
            "type": "string",
            "minLength": 1
          },
          "nativeId": {
            "type": "string",
            "minLength": 1
          },
          "venueSymbol": {
            "type": "string",
            "minLength": 1
          },
          "decimals": {
            "type": "integer",
            "minimum": 0,
            "maximum": 9007199254740991
          },
          "listingState": {
            "type": "string",
            "enum": [
              "candidate",
              "shadow",
              "paper",
              "live",
              "paused",
              "deprecated"
            ]
          },
          "quoteAssetKeys": {
            "minItems": 1,
            "type": "array",
            "items": {
              "type": "string",
              "minLength": 1
            }
          },
          "priceDecimals": {
            "type": "integer",
            "minimum": 0,
            "maximum": 9007199254740991
          },
          "sizeDecimals": {
            "type": "integer",
            "minimum": 0,
            "maximum": 9007199254740991
          },
          "minNotionalUsd": {
            "type": "string",
            "pattern": "^\\d+(?:\\.\\d+)?$"
          },
          "notes": {
            "type": "string",
            "minLength": 1
          }
        },
        "required": [
          "venueKey",
          "nativeId",
          "venueSymbol",
          "decimals",
          "listingState",
          "quoteAssetKeys"
        ],
        "additionalProperties": false
      }
    },
    "createdAt": {
      "type": "string",
      "format": "date-time",
      "pattern": "^(?:(?:\\d\\d[2468][048]|\\d\\d[13579][26]|\\d\\d0[48]|[02468][048]00|[13579][26]00)-02-29|\\d{4}-(?:(?:0[13578]|1[02])-(?:0[1-9]|[12]\\d|3[01])|(?:0[469]|11)-(?:0[1-9]|[12]\\d|30)|(?:02)-(?:0[1-9]|1\\d|2[0-8])))T(?:(?:[01]\\d|2[0-3]):[0-5]\\d(?::[0-5]\\d(?:\\.\\d+)?)?(?:Z|([+-](?:[01]\\d|2[0-3]):[0-5]\\d)))$"
    },
    "updatedAt": {
      "type": "string",
      "format": "date-time",
      "pattern": "^(?:(?:\\d\\d[2468][048]|\\d\\d[13579][26]|\\d\\d0[48]|[02468][048]00|[13579][26]00)-02-29|\\d{4}-(?:(?:0[13578]|1[02])-(?:0[1-9]|[12]\\d|3[01])|(?:0[469]|11)-(?:0[1-9]|[12]\\d|30)|(?:02)-(?:0[1-9]|1\\d|2[0-8])))T(?:(?:[01]\\d|2[0-3]):[0-5]\\d(?::[0-5]\\d(?:\\.\\d+)?)?(?:Z|([+-](?:[01]\\d|2[0-3]):[0-5]\\d)))$"
    },
    "promotedAt": {
      "type": "string",
      "format": "date-time",
      "pattern": "^(?:(?:\\d\\d[2468][048]|\\d\\d[13579][26]|\\d\\d0[48]|[02468][048]00|[13579][26]00)-02-29|\\d{4}-(?:(?:0[13578]|1[02])-(?:0[1-9]|[12]\\d|3[01])|(?:0[469]|11)-(?:0[1-9]|[12]\\d|30)|(?:02)-(?:0[1-9]|1\\d|2[0-8])))T(?:(?:[01]\\d|2[0-3]):[0-5]\\d(?::[0-5]\\d(?:\\.\\d+)?)?(?:Z|([+-](?:[01]\\d|2[0-3]):[0-5]\\d)))$"
    },
    "pausedAt": {
      "type": "string",
      "format": "date-time",
      "pattern": "^(?:(?:\\d\\d[2468][048]|\\d\\d[13579][26]|\\d\\d0[48]|[02468][048]00|[13579][26]00)-02-29|\\d{4}-(?:(?:0[13578]|1[02])-(?:0[1-9]|[12]\\d|3[01])|(?:0[469]|11)-(?:0[1-9]|[12]\\d|30)|(?:02)-(?:0[1-9]|1\\d|2[0-8])))T(?:(?:[01]\\d|2[0-3]):[0-5]\\d(?::[0-5]\\d(?:\\.\\d+)?)?(?:Z|([+-](?:[01]\\d|2[0-3]):[0-5]\\d)))$"
    },
    "deprecatedAt": {
      "type": "string",
      "format": "date-time",
      "pattern": "^(?:(?:\\d\\d[2468][048]|\\d\\d[13579][26]|\\d\\d0[48]|[02468][048]00|[13579][26]00)-02-29|\\d{4}-(?:(?:0[13578]|1[02])-(?:0[1-9]|[12]\\d|3[01])|(?:0[469]|11)-(?:0[1-9]|[12]\\d|30)|(?:02)-(?:0[1-9]|1\\d|2[0-8])))T(?:(?:[01]\\d|2[0-3]):[0-5]\\d(?::[0-5]\\d(?:\\.\\d+)?)?(?:Z|([+-](?:[01]\\d|2[0-3]):[0-5]\\d)))$"
    },
    "tags": {
      "maxItems": 16,
      "type": "array",
      "items": {
        "type": "string",
        "minLength": 1
      }
    },
    "notes": {
      "type": "string",
      "minLength": 1
    }
  },
  "required": [
    "schemaVersion",
    "assetKey",
    "displayName",
    "symbol",
    "chainKey",
    "canonicalId",
    "assetKind",
    "riskClass",
    "listingState",
    "decimals",
    "aliases",
    "quoteAssetKeys",
    "venueMappings",
    "createdAt",
    "updatedAt",
    "tags"
  ],
  "additionalProperties": false
}
